{
  "project": "shop",
  "environment": "production",
  "state": "succeeded",
  "revision": "235ff62aa1b2c3d4e5f60718293a4b5c6d7e8f90",
  "previous": "29a50be",
  "tickets": ["SHOP-3"],
  "release": "shop-2026.10.12",
  "at": "2026-10-12T22:04:19Z",
  "source": { "system": "github", "run": "1001", "url": "https://github.com/acme/shop/actions/runs/11223344/job/9988" }
}
